{
  "$schema": "../../schema/game-card.schema.json",
  "slug": "garfimon",
  "name": "Garfimon",
  "blurb": "Collect cards, build your team, and battle 8 Gym Leaders!",
  "added": "2026-07-18",
  "icon": {
    "emoji": "⚡"
  },
  "title": {
    "font": "Luckiest Guy",
    "weight": 400,
    "size": 34,
    "color": "#ffd32a",
    "shadow": "3px 3px 0 #1d3f8f"
  },
  "background": {
    "gradient": [
      "#f1c40f",
      "#e74c3c",
      "#3498db"
    ],
    "css": "repeating-conic-gradient(from 0deg at 50% 60%, #e74c3c 0 10deg, #ff6b5a 10deg 20deg)"
  }
}
