{
  "$schema": "../../schema/game-card.schema.json",
  "slug": "race-maker",
  "name": "Race Maker",
  "blurb": "Build your own track, then race it with corner braking and AI!",
  "added": "2026-05-10",
  "icon": {
    "emoji": "🏁"
  },
  "title": {
    "font": "Bebas Neue",
    "weight": 400,
    "size": 42,
    "color": "#fff",
    "letterSpacing": ".02em"
  },
  "background": {
    "gradient": [
      "#1a1a2e",
      "#dc2626",
      "#fbbf24"
    ],
    "css": "linear-gradient(90deg,#c81e1e 0 80%, transparent 80%), conic-gradient(#111 25%, #f4f4f4 0 50%, #111 0 75%, #f4f4f4 0) 0 0/24px 24px"
  }
}
