{
  "$schema": "../../schema/game-card.schema.json",
  "slug": "maze",
  "name": "Tilt Maze",
  "blurb": "100 levels! Tilt the 3D board to roll balls to the goal.",
  "added": "2026-04-25",
  "icon": {
    "emoji": "🌀"
  },
  "title": {
    "font": "Comfortaa",
    "weight": 700,
    "size": 28,
    "color": "#3a2a22",
    "shadow": "none"
  },
  "blurbStyle": {
    "color": "#5a4a3f",
    "shadow": "none"
  },
  "background": {
    "gradient": [
      "#ddd0c8",
      "#c4b5ab",
      "#e8524a"
    ],
    "css": "repeating-radial-gradient(circle at 50% 50%, #e6d8cc 0 14px, #d4c2b3 14px 16px)"
  }
}
