{
  "$schema": "../../schema/game-card.schema.json",
  "slug": "sea-glass",
  "name": "Sea Glass",
  "blurb": "Swipe the pebbles aside, tap the sea glass and build your Collection!",
  "added": "2026-08-17",
  "icon": {
    "emoji": "🐚"
  },
  "title": {
    "font": "Quicksand",
    "weight": 700,
    "size": 30,
    "color": "#0f5f74",
    "shadow": "none"
  },
  "blurbStyle": {
    "color": "#35606b",
    "shadow": "none"
  },
  "background": {
    "gradient": [
      "#0f5f74",
      "#3fbfae",
      "#e8d5a9"
    ],
    "css": "radial-gradient(circle at 18% 80%, rgba(63,191,174,.6) 0 13%, transparent 14%), radial-gradient(circle at 70% 26%, rgba(120,200,240,.6) 0 9%, transparent 10%), linear-gradient(#f2e6c9,#e8d5a9)"
  }
}
