{
  "$schema": "../../schema/game-card.schema.json",
  "slug": "callisto",
  "name": "Captain Callisto",
  "blurb": "Jetpack through alien worlds and collect treasure!",
  "added": "2026-04-21",
  "updated": "2026-09-28",
  "icon": {
    "emoji": "👨‍🚀"
  },
  "background": {
    "gradient": [
      "#1a0a2e",
      "#3d1a78",
      "#ff6b35"
    ]
  },
  "source": {
    "files": [
      "games/callisto/index.html"
    ],
    "refreshed": "2026-09-28",
    "notes": "Engine port with no readable fonts or palette in the page; left as is."
  }
}
