{
  "$schema": "../../schema/game-card.schema.json",
  "slug": "shed",
  "name": "Shed",
  "blurb": "Burn the pile and be first to lose all your cards!",
  "added": "2026-04-17",
  "icon": {
    "emoji": "🃏"
  },
  "background": {
    "gradient": [
      "#922b21",
      "#7b241c",
      "#cb4335"
    ]
  }
}
