{
  "$schema": "../../schema/game-card.schema.json",
  "slug": "rps",
  "name": "Rock Paper Scissors",
  "blurb": "Classic RPS with custom sets and AI-made icons!",
  "added": "2026-04-15",
  "icon": {
    "emoji": "✊"
  },
  "background": {
    "gradient": [
      "#8e44ad",
      "#6c3483",
      "#a569bd"
    ]
  }
}
