{
  "$schema": "../../schema/game-card.schema.json",
  "slug": "crazyeights",
  "name": "Crazy Eights",
  "blurb": "Match suits or ranks — eights are wild!",
  "added": "2026-04-16",
  "icon": {
    "emoji": "🎴"
  },
  "title": {
    "font": "Abril Fatface",
    "weight": 400,
    "size": 32,
    "color": "#fff"
  },
  "background": {
    "gradient": [
      "#d4ac0d",
      "#b7950b",
      "#f1c40f"
    ],
    "css": "radial-gradient(ellipse at 50% 40%, #c23a2e, #6b1410)"
  }
}
