{
  "$schema": "../../schema/game-card.schema.json",
  "slug": "freekick",
  "name": "Free Kick",
  "blurb": "Aim and swipe to curve the ball past the wall!",
  "added": "2026-04-14",
  "icon": {
    "emoji": "🥅"
  },
  "background": {
    "gradient": [
      "#2980b9",
      "#1a5276",
      "#3498db"
    ]
  }
}
