{
  "$schema": "../../schema/game-card.schema.json",
  "slug": "soccer",
  "name": "Sensible Soccer",
  "blurb": "Full 11v11 match — pass, shoot, tackle!",
  "added": "2026-04-14",
  "icon": {
    "emoji": "⚽"
  },
  "title": {
    "font": "Teko",
    "weight": 600,
    "size": 42,
    "color": "#fff",
    "letterSpacing": ".02em",
    "transform": "uppercase"
  },
  "background": {
    "gradient": [
      "#27ae60",
      "#1e8449",
      "#2ecc71"
    ],
    "css": "repeating-linear-gradient(90deg, #2f9a4a 0 36px, #2a8a42 36px 72px)"
  }
}
