{
  "$schema": "../../schema/game-card.schema.json",
  "slug": "snail",
  "name": "Snail",
  "blurb": "Stretch forward and dodge falling blocks!",
  "added": "2026-04-18",
  "icon": {
    "emoji": "🐌"
  },
  "background": {
    "gradient": [
      "#6c5ce7",
      "#4834d4",
      "#7ab648"
    ]
  }
}
