{
  "$schema": "../../schema/game-card.schema.json",
  "slug": "bomberman",
  "name": "Bomberman",
  "blurb": "Place bombs and blast your way through!",
  "added": "2026-04-09",
  "icon": {
    "emoji": "💣"
  },
  "background": {
    "gradient": [
      "#e74c3c",
      "#e67e22",
      "#f39c12"
    ]
  }
}
