{
  "$schema": "../../schema/game-card.schema.json",
  "slug": "fling",
  "name": "Fling!",
  "blurb": "Launch critters off your wave into the ceiling!",
  "added": "2026-04-17",
  "icon": {
    "emoji": "💨"
  },
  "background": {
    "gradient": [
      "#6c5ce7",
      "#4834d4",
      "#a29bfe"
    ]
  }
}
