{
  "$schema": "../../schema/game-card.schema.json",
  "slug": "arcanoid",
  "name": "Arcanoid",
  "blurb": "Bounce the ball and smash all the bricks!",
  "added": "2026-03-29",
  "icon": {
    "emoji": "🏓"
  },
  "title": {
    "font": "Audiowide",
    "weight": 400,
    "size": 28,
    "color": "#fff"
  },
  "background": {
    "gradient": [
      "#e74c3c",
      "#c0392b",
      "#ff6b6b"
    ],
    "css": "repeating-linear-gradient(0deg, rgba(0,0,0,.2) 0 2px, transparent 2px 22px), repeating-linear-gradient(90deg, rgba(0,0,0,.2) 0 2px, transparent 2px 44px), linear-gradient(160deg,#ff5a4e,#b0231a)"
  }
}
