{
  "$schema": "../../schema/game-card.schema.json",
  "slug": "solitaire",
  "name": "Solitaire",
  "blurb": "Classic Klondike — stack, sort, and clear the deck!",
  "added": "2026-04-16",
  "icon": {
    "emoji": "♠️"
  },
  "title": {
    "font": "Playfair Display",
    "weight": 800,
    "size": 32,
    "color": "#fff8e6"
  },
  "background": {
    "gradient": [
      "#1a5276",
      "#154360",
      "#2471a3"
    ],
    "css": "radial-gradient(ellipse at 50% 40%, #1f7a4a, #0c3d24)"
  }
}
