{
  "$schema": "../../schema/game-card.schema.json",
  "slug": "sus-guy-station",
  "name": "Sus Guy Station",
  "blurb": "Walk the Underground passage. Something different? Turn back!",
  "added": "2026-10-04",
  "icon": {
    "emoji": "🚇"
  },
  "title": {
    "font": "Gabarito",
    "weight": 900,
    "size": 38,
    "color": "#F6EEDC",
    "letterSpacing": "-0.02em",
    "shadow": "0 3px 0 #173F45, 0 5px 14px rgba(0,0,0,.35)"
  },
  "blurbStyle": {
    "color": "#1E1E1E",
    "shadow": "none"
  },
  "background": {
    "gradient": [
      "#E8572A",
      "#F3B33D",
      "#1F6F78"
    ],
    "css": "radial-gradient(circle at 80% 24%, #173F45 0 9%, #1F6F78 9.5% 17%, #F3B33D 17.5% 26%, transparent 26.5%), linear-gradient(transparent 0 95%, #1F6F78 95%), linear-gradient(#E8572A, #E8572A)"
  },
  "source": {
    "files": [
      "games/sus-guy-station/index.html"
    ],
    "refreshed": "2026-10-04",
    "notes": "Home poster is Gabarito 900 in cream #F6EEDC on Underground orange #E8572A, with the yellow / teal / dark-teal target rings at the top and the teal #1F6F78 'Get to Platform 10' strip along the bottom. Blurb in ink #1E1E1E for contrast on the orange. Rebuilt from the Claude Design card.json."
  },
  "updated": "2026-10-04"
}
