{
  "$schema": "../../schema/game-card.schema.json",
  "slug": "resincritters",
  "name": "Resin Animals",
  "blurb": "Match, collect & combine resin animals together!",
  "added": "2026-05-05",
  "icon": {
    "emoji": "🦊"
  },
  "background": {
    "gradient": [
      "#a29bfe",
      "#6c5ce7",
      "#fd79a8"
    ]
  }
}
